<?xml version="1.0" ?>
<!DOCTYPE program
  SYSTEM 'ecohydrology.dtd'>
<program>
  <progName>licor6262test.CR8</progName>
  <tables>
    <table>
      <outputInterval>1.0</outputInterval>
      <tableName>licor6262</tableName>
      <variables>
        <variable>
          <varName>batt_volt_Min</varName>
          <origName>batt_volt</origName>
          <tableColumn>1</tableColumn>
          <varUnits></varUnits>
          <varType>Minimum</varType>
        </variable>
        <variable>
          <varName>PTemp</varName>
          <origName>PTemp</origName>
          <tableColumn>2</tableColumn>
          <varUnits></varUnits>
          <varType>Sample</varType>
        </variable>
        <variable>
          <varName>mvco2_6262</varName>
          <origName>licor6262</origName>
          <tableColumn>3</tableColumn>
          <varUnits></varUnits>
          <varType>Sample</varType>
        </variable>
        <variable>
          <varName>mvh2o_6262</varName>
          <origName>licor6262</origName>
          <tableColumn>4</tableColumn>
          <varUnits></varUnits>
          <varType>Sample</varType>
        </variable>
        <variable>
          <varName>mvpress_6262</varName>
          <origName>licor6262</origName>
          <tableColumn>5</tableColumn>
          <varUnits></varUnits>
          <varType>Sample</varType>
        </variable>
        <variable>
          <varName>mvtemp_6262</varName>
          <origName>licor6262</origName>
          <tableColumn>6</tableColumn>
          <varUnits></varUnits>
          <varType>Sample</varType>
        </variable>
        <variable>
          <varName>co2_6262</varName>
          <origName>licor6262</origName>
          <tableColumn>7</tableColumn>
          <varUnits>umol/mol</varUnits>
          <varType>Sample</varType>
        </variable>
        <variable>
          <varName>h2o_6262</varName>
          <origName>licor6262</origName>
          <tableColumn>8</tableColumn>
          <varUnits>mmol/mol</varUnits>
          <varType>Sample</varType>
        </variable>
        <variable>
          <varName>co2conc_6262</varName>
          <origName>licor6262</origName>
          <tableColumn>9</tableColumn>
          <varUnits>ug/g</varUnits>
          <varType>Sample</varType>
        </variable>
        <variable>
          <varName>h2oconc_6262</varName>
          <origName>licor6262</origName>
          <tableColumn>10</tableColumn>
          <varUnits>mg/g</varUnits>
          <varType>Sample</varType>
        </variable>
        <variable>
          <varName>press_6262</varName>
          <origName>licor6262</origName>
          <tableColumn>11</tableColumn>
          <varUnits>kPa</varUnits>
          <varType>Sample</varType>
        </variable>
        <variable>
          <varName>temp_6262</varName>
          <origName>licor6262</origName>
          <tableColumn>12</tableColumn>
          <varUnits>degC</varUnits>
          <varType>Sample</varType>
        </variable>
        <variable>
          <varName>testco2</varName>
          <origName>caltest</origName>
          <tableColumn>13</tableColumn>
          <varUnits></varUnits>
          <varType>Sample</varType>
        </variable>
        <variable>
          <varName>testh20</varName>
          <origName>caltest</origName>
          <tableColumn>14</tableColumn>
          <varUnits></varUnits>
          <varType>Sample</varType>
        </variable>
      </variables>
    </table>
  </tables>
</program>

