<?xml version="1.0" ?>
<!DOCTYPE program
  SYSTEM 'ecohydrology.dtd'>
<program>
	<progName>CS616Calibration.CR3</progName>
	<tables>
		<table>
			<outputInterval>10.0</outputInterval>
			<tableName>CS616Cal</tableName>
			<variables>
				<variable>
					<varName>Batt_Volt</varName>
					<tableColumn>1</tableColumn>
					<varUnits>Volts</varUnits>
					<varType>Sample</varType>
				</variable>
				<variable>
					<varName>VW</varName>
					<tableColumn>2</tableColumn>
					<varUnits></varUnits>
					<varType>Sample</varType>
				</variable>
				<variable>
					<varName>PA_uS</varName>
					<tableColumn>3</tableColumn>
					<varUnits>uSec</varUnits>
					<varType>Sample</varType>
				</variable>
				<variable>
					<varName>VW_2</varName>
					<tableColumn>4</tableColumn>
					<varUnits></varUnits>
					<varType>Sample</varType>
				</variable>
				<variable>
					<varName>PA_uS_2</varName>
					<tableColumn>5</tableColumn>
					<varUnits>uSec</varUnits>
					<varType>Sample</varType>
				</variable>
				<variable>
					<varName>VW_3</varName>
					<tableColumn>6</tableColumn>
					<varUnits></varUnits>
					<varType>Sample</varType>
				</variable>
				<variable>
					<varName>PA_uS_3</varName>
					<tableColumn>7</tableColumn>
					<varUnits>uSec</varUnits>
					<varType>Sample</varType>
				</variable>
				<variable>
					<varName>VW_4</varName>
					<tableColumn>8</tableColumn>
					<varUnits></varUnits>
					<varType>Sample</varType>
				</variable>
				<variable>
					<varName>PA_uS_4</varName>
					<tableColumn>9</tableColumn>
					<varUnits>uSec</varUnits>
					<varType>Sample</varType>
				</variable>
				<variable>
					<varName>VW_5</varName>
					<tableColumn>10</tableColumn>
					<varUnits></varUnits>
					<varType>Sample</varType>
				</variable>
			</variables>
		</table>
		<table>
			<outputInterval>86400.0</outputInterval>
			<tableName>Table2</tableName>
			<variables/>
		</table>
	</tables>
</program>

