<?xml version="1.0" ?>
<!DOCTYPE program
  SYSTEM 'ecohydrology.dtd'>
<program>
	<progName>CR3000_soilmoisutre.CR3</progName>
	<tables>
		<table>
			<outputInterval>3600.0</outputInterval>
			<tableName>Table1</tableName>
			<variables>
				<variable>
					<varName>Batt_Volt_Avg</varName>
					<tableColumn>1</tableColumn>
					<varUnits>Volts</varUnits>
					<varType>Average</varType>
				</variable>
				<variable>
					<varName>VW_Avg</varName>
					<tableColumn>2</tableColumn>
					<varUnits></varUnits>
					<varType>Average</varType>
				</variable>
				<variable>
					<varName>VW_2_Avg</varName>
					<tableColumn>3</tableColumn>
					<varUnits></varUnits>
					<varType>Average</varType>
				</variable>
				<variable>
					<varName>VW_3_Avg</varName>
					<tableColumn>4</tableColumn>
					<varUnits></varUnits>
					<varType>Average</varType>
				</variable>
				<variable>
					<varName>VW_4_Avg</varName>
					<tableColumn>5</tableColumn>
					<varUnits></varUnits>
					<varType>Average</varType>
				</variable>
				<variable>
					<varName>VW_5_Avg</varName>
					<tableColumn>6</tableColumn>
					<varUnits></varUnits>
					<varType>Average</varType>
				</variable>
				<variable>
					<varName>T108_C_Avg</varName>
					<tableColumn>7</tableColumn>
					<varUnits>Deg C</varUnits>
					<varType>Average</varType>
				</variable>
				<variable>
					<varName>T108_C_2_Avg</varName>
					<tableColumn>8</tableColumn>
					<varUnits>Deg C</varUnits>
					<varType>Average</varType>
				</variable>
				<variable>
					<varName>VW_Std</varName>
					<tableColumn>9</tableColumn>
					<varUnits></varUnits>
					<varType>StdDev</varType>
				</variable>
				<variable>
					<varName>VW_2_Std</varName>
					<tableColumn>10</tableColumn>
					<varUnits></varUnits>
					<varType>StdDev</varType>
				</variable>
				<variable>
					<varName>VW_3_Std</varName>
					<tableColumn>11</tableColumn>
					<varUnits></varUnits>
					<varType>StdDev</varType>
				</variable>
				<variable>
					<varName>VW_4_Std</varName>
					<tableColumn>12</tableColumn>
					<varUnits></varUnits>
					<varType>StdDev</varType>
				</variable>
				<variable>
					<varName>VW_5_Std</varName>
					<tableColumn>13</tableColumn>
					<varUnits></varUnits>
					<varType>StdDev</varType>
				</variable>
				<variable>
					<varName>T108_C_Std</varName>
					<tableColumn>14</tableColumn>
					<varUnits>Deg C</varUnits>
					<varType>StdDev</varType>
				</variable>
			</variables>
		</table>
		<table>
			<outputInterval>86400.0</outputInterval>
			<tableName>Table2</tableName>
			<variables/>
		</table>
	</tables>
</program>

