<?xml version="1.0" ?>
<!DOCTYPE program
  SYSTEM 'ecohydrology.dtd'>
<program>
  <progName>licor6262_10hzv3.cr1</progName>
  <tables>
    <table>
      <outputInterval>0.1</outputInterval>
      <tableName>licor6262</tableName>
      <variables>
        <variable>
          <varName>batt_volt</varName>
          <origName>batt_volt</origName>
          <tableColumn>1</tableColumn>
          <varUnits></varUnits>
          <varType>Sample</varType>
        </variable>
        <variable>
          <varName>co2</varName>
          <origName>co2</origName>
          <insName>LI-7500</insName>
          <obsName>CO2 Concentration</obsName>
          <tableColumn>2</tableColumn>
          <varUnits></varUnits>
          <varType>Sample</varType>
        </variable>
        <variable>
          <varName>h2o</varName>
          <origName>h2o</origName>
          <insName>LI-7500</insName>
          <obsName>H2O Concentration</obsName>
          <tableColumn>3</tableColumn>
          <varUnits></varUnits>
          <varType>Sample</varType>
        </variable>
        <variable>
          <varName>press</varName>
          <origName>licor6262</origName>
          <insName>LI-7500</insName>
          <obsName>Atmospheric Pressure</obsName>
          <tableColumn>4</tableColumn>
          <varUnits></varUnits>
          <varType>Sample</varType>
        </variable>
        <variable>
          <varName>temp</varName>
          <origName>licor6262</origName>
          <tableColumn>5</tableColumn>
          <varUnits></varUnits>
          <varType>Sample</varType>
        </variable>
      </variables>
    </table>
    <table>
      <outputInterval>1800.0</outputInterval>
      <tableName>licor6262_AVG</tableName>
      <variables>
        <variable>
          <varName>batt_volt_Avg</varName>
          <origName>batt_volt</origName>
          <tableColumn>1</tableColumn>
          <varUnits></varUnits>
          <varType>Average</varType>
        </variable>
        <variable>
          <varName>co2_Avg</varName>
          <origName>co2</origName>
          <insName>LI-7500</insName>
          <obsName>CO2 Concentration</obsName>
          <tableColumn>2</tableColumn>
          <varUnits></varUnits>
          <varType>Average</varType>
        </variable>
        <variable>
          <varName>h2o_Avg</varName>
          <origName>h2o</origName>
          <insName>LI-7500</insName>
          <obsName>H2O Concentration</obsName>
          <tableColumn>3</tableColumn>
          <varUnits></varUnits>
          <varType>Average</varType>
        </variable>
        <variable>
          <varName>press_Avg</varName>
          <origName>licor6262</origName>
          <insName>LI-7500</insName>
          <obsName>Atmospheric Pressure</obsName>
          <tableColumn>4</tableColumn>
          <varUnits></varUnits>
          <varType>Average</varType>
        </variable>
        <variable>
          <varName>temp_Avg</varName>
          <origName>licor6262</origName>
          <tableColumn>5</tableColumn>
          <varUnits></varUnits>
          <varType>Average</varType>
        </variable>
        <variable>
          <varName>batt_volt_Std</varName>
          <origName>batt_volt</origName>
          <tableColumn>6</tableColumn>
          <varUnits></varUnits>
          <varType>StdDev</varType>
        </variable>
        <variable>
          <varName>co2_Std</varName>
          <origName>co2</origName>
          <insName>LI-7500</insName>
          <obsName>CO2 Concentration</obsName>
          <tableColumn>7</tableColumn>
          <varUnits></varUnits>
          <varType>StdDev</varType>
        </variable>
        <variable>
          <varName>h2o_Std</varName>
          <origName>h2o</origName>
          <insName>LI-7500</insName>
          <obsName>H2O Concentration</obsName>
          <tableColumn>8</tableColumn>
          <varUnits></varUnits>
          <varType>StdDev</varType>
        </variable>
        <variable>
          <varName>press_Std</varName>
          <origName>licor6262</origName>
          <insName>LI-7500</insName>
          <obsName>Atmospheric Pressure</obsName>
          <tableColumn>9</tableColumn>
          <varUnits></varUnits>
          <varType>StdDev</varType>
        </variable>
        <variable>
          <varName>temp_Std</varName>
          <origName>licor6262</origName>
          <tableColumn>10</tableColumn>
          <varUnits></varUnits>
          <varType>StdDev</varType>
        </variable>
      </variables>
    </table>
  </tables>
</program>

