<?xml version="1.0" ?>
<!DOCTYPE program
  SYSTEM 'ecohydrology.dtd'>
<program>
  <progName>4lws.CR1</progName>
  <tables>
    <table>
      <outputInterval>60.0</outputInterval>
      <tableName>Table1</tableName>
      <variables>
        <variable>
          <varName>BattV_Avg</varName>
          <origName>BattV</origName>
          <tableColumn>1</tableColumn>
          <varUnits>Volts</varUnits>
          <varType>Average</varType>
        </variable>
        <variable>
          <varName>LWmV_Avg</varName>
          <origName>LWmV</origName>
          <insName>LWS-L</insName>
          <obsName>Leaf Wetness Sensor Voltage</obsName>
          <tableColumn>2</tableColumn>
          <varUnits>mV</varUnits>
          <varType>Average</varType>
        </variable>
        <variable>
          <varName>LWMDry_Tot</varName>
          <origName>LWMDry</origName>
          <insName>LWS-L</insName>
          <obsName>Time that the Leaf Wetness Sensor is Dry</obsName>
          <tableColumn>3</tableColumn>
          <varUnits>Minutes</varUnits>
          <varType>Totalize</varType>
        </variable>
        <variable>
          <varName>LWMCon_Tot</varName>
          <origName>LWMCon</origName>
          <insName>LWS-L</insName>
          <obsName>Time that the Leaf Wetness Sensor is Contaminated</obsName>
          <tableColumn>4</tableColumn>
          <varUnits>Minutes</varUnits>
          <varType>Totalize</varType>
        </variable>
        <variable>
          <varName>LWMWet_Tot</varName>
          <origName>LWMWet</origName>
          <insName>LWS-L</insName>
          <obsName>Time that the Leaf Wetness Sensor is Wet</obsName>
          <tableColumn>5</tableColumn>
          <varUnits>Minutes</varUnits>
          <varType>Totalize</varType>
        </variable>
        <variable>
          <varName>LWmV_2_Avg</varName>
          <origName>LWmV_2</origName>
          <insName>LWS-L</insName>
          <obsName>Leaf Wetness Sensor Voltage</obsName>
          <tableColumn>6</tableColumn>
          <varUnits>mV</varUnits>
          <varType>Average</varType>
        </variable>
        <variable>
          <varName>LWMDry_2_Tot</varName>
          <origName>LWMDry_2</origName>
          <insName>LWS-L</insName>
          <obsName>Time that the Leaf Wetness Sensor is Dry</obsName>
          <tableColumn>7</tableColumn>
          <varUnits>Minutes</varUnits>
          <varType>Totalize</varType>
        </variable>
        <variable>
          <varName>LWMCon_2_Tot</varName>
          <origName>LWMCon_2</origName>
          <insName>LWS-L</insName>
          <obsName>Time that the Leaf Wetness Sensor is Contaminated</obsName>
          <tableColumn>8</tableColumn>
          <varUnits>Minutes</varUnits>
          <varType>Totalize</varType>
        </variable>
        <variable>
          <varName>LWMWet_2_Tot</varName>
          <origName>LWMWet_2</origName>
          <insName>LWS-L</insName>
          <obsName>Time that the Leaf Wetness Sensor is Wet</obsName>
          <tableColumn>9</tableColumn>
          <varUnits>Minutes</varUnits>
          <varType>Totalize</varType>
        </variable>
        <variable>
          <varName>LWmV_3_Avg</varName>
          <origName>LWmV_3</origName>
          <insName>LWS-L</insName>
          <obsName>Leaf Wetness Sensor Voltage</obsName>
          <tableColumn>10</tableColumn>
          <varUnits>mV</varUnits>
          <varType>Average</varType>
        </variable>
        <variable>
          <varName>LWMDry_3_Tot</varName>
          <origName>LWMDry_3</origName>
          <insName>LWS-L</insName>
          <obsName>Time that the Leaf Wetness Sensor is Dry</obsName>
          <tableColumn>11</tableColumn>
          <varUnits>Minutes</varUnits>
          <varType>Totalize</varType>
        </variable>
        <variable>
          <varName>LWMCon_3_Tot</varName>
          <origName>LWMCon_3</origName>
          <insName>LWS-L</insName>
          <obsName>Time that the Leaf Wetness Sensor is Contaminated</obsName>
          <tableColumn>12</tableColumn>
          <varUnits>Minutes</varUnits>
          <varType>Totalize</varType>
        </variable>
        <variable>
          <varName>LWMWet_3_Tot</varName>
          <origName>LWMWet_3</origName>
          <insName>LWS-L</insName>
          <obsName>Time that the Leaf Wetness Sensor is Wet</obsName>
          <tableColumn>13</tableColumn>
          <varUnits>Minutes</varUnits>
          <varType>Totalize</varType>
        </variable>
        <variable>
          <varName>LWmV_4_Avg</varName>
          <origName>LWmV_4</origName>
          <insName>LWS-L</insName>
          <obsName>Leaf Wetness Sensor Voltage</obsName>
          <tableColumn>14</tableColumn>
          <varUnits>mV</varUnits>
          <varType>Average</varType>
        </variable>
        <variable>
          <varName>LWMDry_4_Tot</varName>
          <origName>LWMDry_4</origName>
          <insName>LWS-L</insName>
          <obsName>Time that the Leaf Wetness Sensor is Dry</obsName>
          <tableColumn>15</tableColumn>
          <varUnits>Minutes</varUnits>
          <varType>Totalize</varType>
        </variable>
        <variable>
          <varName>LWMCon_4_Tot</varName>
          <origName>LWMCon_4</origName>
          <insName>LWS-L</insName>
          <obsName>Time that the Leaf Wetness Sensor is Contaminated</obsName>
          <tableColumn>16</tableColumn>
          <varUnits>Minutes</varUnits>
          <varType>Totalize</varType>
        </variable>
        <variable>
          <varName>LWMWet_4_Tot</varName>
          <origName>LWMWet_4</origName>
          <insName>LWS-L</insName>
          <obsName>Time that the Leaf Wetness Sensor is Wet</obsName>
          <tableColumn>17</tableColumn>
          <varUnits>Minutes</varUnits>
          <varType>Totalize</varType>
        </variable>
      </variables>
    </table>
    <table>
      <outputInterval>86400.0</outputInterval>
      <tableName>Table2</tableName>
      <variables>
        <variable>
          <varName>BattV_Min</varName>
          <origName>BattV</origName>
          <tableColumn>1</tableColumn>
          <varUnits>Volts</varUnits>
          <varType>Minimum</varType>
        </variable>
      </variables>
    </table>
  </tables>
</program>

